{
  "accepted_at": "2026-08-29T02:19:26Z",
  "command": "execution.submit",
  "commander_id": "chatgpt-web-session",
  "commander_response": {
    "execution_id": "chatgpt-router-remove-subagent-import-20260829T0233Z",
    "schema": "zero3.execution-acceptance/1.0",
    "task_id": "pilot-task-b9a1f41ccf994a77"
  },
  "correlation": "task_id",
  "execution_id": "chatgpt-router-remove-subagent-import-20260829T0233Z",
  "schema": "zero3.commander.command-accepted/1.0",
  "task_id": "pilot-task-b9a1f41ccf994a77"
}
