{
  "accepted_at": "2026-08-28T17:09:02Z",
  "command": "execution.submit",
  "commander_id": "chatgpt-web-session",
  "commander_response": {
    "execution_id": "chatgpt-output-test-20260828T1709Z",
    "schema": "zero3.execution-acceptance/1.0",
    "task_id": "pilot-task-0f83c9a709564a14"
  },
  "correlation": "task_id",
  "execution_id": "chatgpt-output-test-20260828T1709Z",
  "schema": "zero3.commander.command-accepted/1.0",
  "task_id": "pilot-task-0f83c9a709564a14"
}
