{
  "accepted_at": "2026-08-29T01:34:26Z",
  "command": "execution.submit",
  "commander_id": "chatgpt-web-session",
  "commander_response": {
    "execution_id": "chatgpt-router-node-dispatch-20260829T0135Z",
    "schema": "zero3.execution-acceptance/1.0",
    "task_id": "pilot-task-6db7f4aa545b4baa"
  },
  "correlation": "task_id",
  "execution_id": "chatgpt-router-node-dispatch-20260829T0135Z",
  "schema": "zero3.commander.command-accepted/1.0",
  "task_id": "pilot-task-6db7f4aa545b4baa"
}
