{
  "accepted_at": "2026-08-28T21:10:52Z",
  "command": "execution.submit",
  "commander_id": "chatgpt-web-session",
  "commander_response": {
    "execution_id": "chatgpt-installer-weixin-refresh-20260828T2110Z",
    "schema": "zero3.execution-acceptance/1.0",
    "task_id": "pilot-task-672a43ee295f4377"
  },
  "correlation": "task_id",
  "execution_id": "chatgpt-installer-weixin-refresh-20260828T2110Z",
  "schema": "zero3.commander.command-accepted/1.0",
  "task_id": "pilot-task-672a43ee295f4377"
}
