{
  "accepted_at": "2026-08-28T17:52:12Z",
  "command": "execution.submit",
  "commander_id": "chatgpt-web-session",
  "commander_response": {
    "execution_id": "chatgpt-complete-build2-20260828T1754Z",
    "schema": "zero3.execution-acceptance/1.0",
    "task_id": "pilot-task-b81606185e67455b"
  },
  "correlation": "task_id",
  "execution_id": "chatgpt-complete-build2-20260828T1754Z",
  "schema": "zero3.commander.command-accepted/1.0",
  "task_id": "pilot-task-b81606185e67455b"
}
