{
  "accepted_at": "2026-08-29T02:26:34Z",
  "command": "execution.submit",
  "commander_id": "chatgpt-web-session",
  "commander_response": {
    "execution_id": "chatgpt-skills-rec-constructor-method2-20260829T0247Z",
    "schema": "zero3.execution-acceptance/1.0",
    "task_id": "pilot-task-51f3209fe36c4050"
  },
  "correlation": "task_id",
  "execution_id": "chatgpt-skills-rec-constructor-method2-20260829T0247Z",
  "schema": "zero3.commander.command-accepted/1.0",
  "task_id": "pilot-task-51f3209fe36c4050"
}
