{
  "accepted_at": "2026-08-28T21:05:52Z",
  "command": "execution.submit",
  "commander_id": "chatgpt-web-session",
  "commander_response": {
    "execution_id": "chatgpt-weixin-checkout-20260828T2059Z",
    "schema": "zero3.execution-acceptance/1.0",
    "task_id": "pilot-task-4803456e869b44b0"
  },
  "correlation": "task_id",
  "execution_id": "chatgpt-weixin-checkout-20260828T2059Z",
  "schema": "zero3.commander.command-accepted/1.0",
  "task_id": "pilot-task-4803456e869b44b0"
}
