{
  "accepted_at": "2026-08-29T01:30:50Z",
  "command": "execution.submit",
  "commander_id": "chatgpt-web-session",
  "commander_response": {
    "execution_id": "chatgpt-router-node-import-router2-20260829T0131Z",
    "schema": "zero3.execution-acceptance/1.0",
    "task_id": "pilot-task-d84d3850ce7548d5"
  },
  "correlation": "task_id",
  "execution_id": "chatgpt-router-node-import-router2-20260829T0131Z",
  "schema": "zero3.commander.command-accepted/1.0",
  "task_id": "pilot-task-d84d3850ce7548d5"
}
