{
  "accepted_at": "2026-08-29T01:27:37Z",
  "command": "execution.submit",
  "commander_id": "chatgpt-web-session",
  "commander_response": {
    "execution_id": "chatgpt-router-node-imports-20260829T0128Z",
    "schema": "zero3.execution-acceptance/1.0",
    "task_id": "pilot-task-e670d7ec445546ba"
  },
  "correlation": "task_id",
  "execution_id": "chatgpt-router-node-imports-20260829T0128Z",
  "schema": "zero3.commander.command-accepted/1.0",
  "task_id": "pilot-task-e670d7ec445546ba"
}
