{
  "accepted_at": "2026-08-28T20:25:25Z",
  "command": "execution.submit",
  "commander_id": "chatgpt-web-session",
  "commander_response": {
    "execution_id": "chatgpt-final-commit-20260828T2026Z",
    "schema": "zero3.execution-acceptance/1.0",
    "task_id": "pilot-task-3720bc15875849e0"
  },
  "correlation": "task_id",
  "execution_id": "chatgpt-final-commit-20260828T2026Z",
  "schema": "zero3.commander.command-accepted/1.0",
  "task_id": "pilot-task-3720bc15875849e0"
}
