{
  "accepted_at": "2026-08-28T19:52:23Z",
  "command": "execution.submit",
  "commander_id": "chatgpt-web-session",
  "commander_response": {
    "execution_id": "chatgpt-node-fmt1-20260828T1956Z",
    "schema": "zero3.execution-acceptance/1.0",
    "task_id": "pilot-task-3632ecae4a564c8e"
  },
  "correlation": "task_id",
  "execution_id": "chatgpt-node-fmt1-20260828T1956Z",
  "schema": "zero3.commander.command-accepted/1.0",
  "task_id": "pilot-task-3632ecae4a564c8e"
}
