{
  "accepted_at": "2026-08-29T00:55:53Z",
  "command": "execution.submit",
  "commander_id": "chatgpt-web-session",
  "commander_response": {
    "execution_id": "chatgpt-installer-weixin-main-status-20260829T0056Z",
    "schema": "zero3.execution-acceptance/1.0",
    "task_id": "pilot-task-4e435079ed194bdf"
  },
  "correlation": "task_id",
  "execution_id": "chatgpt-installer-weixin-main-status-20260829T0056Z",
  "schema": "zero3.commander.command-accepted/1.0",
  "task_id": "pilot-task-4e435079ed194bdf"
}
