{
  "accepted_at": "2026-08-28T18:30:04Z",
  "command": "execution.submit",
  "commander_id": "chatgpt-web-session",
  "commander_response": {
    "execution_id": "chatgpt-ocu-refresh-20260828T1832Z",
    "schema": "zero3.execution-acceptance/1.0",
    "task_id": "pilot-task-4c214e8a160b45c9"
  },
  "correlation": "task_id",
  "execution_id": "chatgpt-ocu-refresh-20260828T1832Z",
  "schema": "zero3.commander.command-accepted/1.0",
  "task_id": "pilot-task-4c214e8a160b45c9"
}
