{
  "accepted_at": "2026-08-28T18:33:35Z",
  "command": "execution.submit",
  "commander_id": "chatgpt-web-session",
  "commander_response": {
    "execution_id": "chatgpt-ocu-clippy2-20260828T1837Z",
    "schema": "zero3.execution-acceptance/1.0",
    "task_id": "pilot-task-422e546f1733478a"
  },
  "correlation": "task_id",
  "execution_id": "chatgpt-ocu-clippy2-20260828T1837Z",
  "schema": "zero3.commander.command-accepted/1.0",
  "task_id": "pilot-task-422e546f1733478a"
}
