{
  "accepted_at": "2026-08-28T16:32:31Z",
  "command": "execution.submit",
  "commander_id": "chatgpt-web-session",
  "commander_response": {
    "execution_id": "chatgpt-autonomy-clippy-20260828T1633Z",
    "schema": "zero3.execution-acceptance/1.0",
    "task_id": "pilot-task-d30bf7b4ee954b0c"
  },
  "correlation": "task_id",
  "execution_id": "chatgpt-autonomy-clippy-20260828T1633Z",
  "schema": "zero3.commander.command-accepted/1.0",
  "task_id": "pilot-task-d30bf7b4ee954b0c"
}
