{
  "accepted_at": "2026-08-28T18:27:16Z",
  "command": "execution.submit",
  "commander_id": "chatgpt-web-session",
  "commander_response": {
    "execution_id": "chatgpt-ocu-budget-patch-20260828T1828Z",
    "schema": "zero3.execution-acceptance/1.0",
    "task_id": "pilot-task-0fd01052069a43e0"
  },
  "correlation": "task_id",
  "execution_id": "chatgpt-ocu-budget-patch-20260828T1828Z",
  "schema": "zero3.commander.command-accepted/1.0",
  "task_id": "pilot-task-0fd01052069a43e0"
}
