{
  "accepted_at": "2026-08-29T02:17:26Z",
  "command": "execution.submit",
  "commander_id": "chatgpt-web-session",
  "commander_response": {
    "execution_id": "chatgpt-router-weixin-parse-auto-20260829T0229Z",
    "schema": "zero3.execution-acceptance/1.0",
    "task_id": "pilot-task-30be27c595ff482a"
  },
  "correlation": "task_id",
  "execution_id": "chatgpt-router-weixin-parse-auto-20260829T0229Z",
  "schema": "zero3.commander.command-accepted/1.0",
  "task_id": "pilot-task-30be27c595ff482a"
}
