{
  "accepted_at": "2026-08-29T02:18:45Z",
  "command": "execution.submit",
  "commander_id": "chatgpt-web-session",
  "commander_response": {
    "execution_id": "chatgpt-router-skills-build3-20260829T0231Z",
    "schema": "zero3.execution-acceptance/1.0",
    "task_id": "pilot-task-696c8dcc26c246e9"
  },
  "correlation": "task_id",
  "execution_id": "chatgpt-router-skills-build3-20260829T0231Z",
  "schema": "zero3.commander.command-accepted/1.0",
  "task_id": "pilot-task-696c8dcc26c246e9"
}
